{
  "id": "division_grove",
  "title": "Division Grove",
  "subtitle": "Sharing and precision",
  "label": "Division Grove",
  "theme": "division grove",
  "learningObjective": "Sharing and precision",
  "unlockRequirementText": "Complete Multiplication Meadow",
  "startsUnlocked": false,
  "unlockAfterWorldId": "multiplication_meadow",
  "signBox": {
    "x": 0.2424,
    "y": 0.7447,
    "w": 0.1057,
    "h": 0.0644
  },
  "clickBox": null,
  "defaults": {},
  "levels": [
    {
      "id": "division_grove_1",
      "label": "Share by Two",
      "levelNum": 1,
      "slot": 1,
      "activityType": "collect_stream",
      "schemaVersion": 1,
      "sourcePresetId": "collect_multiples_of_2",
      "objective": {
        "rule": {
          "type": "modulo",
          "mod": 2,
          "remainder": 0
        }
      },
      "content": {
        "domain": {
          "kind": "numbers",
          "range": [
            2,
            18
          ]
        },
        "itemCount": 5,
        "spawnDelayRange": [
          1,
          1.35
        ],
        "fallSpeedRange": [
          85,
          125
        ]
      },
      "difficulty": {
        "timeLimit": 56,
        "goal": {
          "type": "catchCount",
          "value": 5
        },
        "phases": []
      },
      "scoring": {
        "pointsPerCorrect": 3,
        "wrongPenalty": 1,
        "wrongFeedback": "Not ×2!",
        "clearReward": 20,
        "bonusTiers": [
          {
            "threshold": 8,
            "reward": 4
          },
          {
            "threshold": 11,
            "reward": 6
          }
        ]
      },
      "presentation": {
        "title": "Double Trail",
        "prompt": "Catch multiples of 2!"
      }
    },
    {
      "id": "division_grove_2",
      "label": "Fives Review",
      "levelNum": 2,
      "slot": 2,
      "activityType": "collect_stream",
      "schemaVersion": 1,
      "sourcePresetId": "collect_multiples_of_5",
      "objective": {
        "rule": {
          "type": "modulo",
          "mod": 5,
          "remainder": 0
        }
      },
      "content": {
        "domain": {
          "kind": "numbers",
          "range": [
            5,
            40
          ]
        },
        "itemCount": 6,
        "spawnDelayRange": [
          0.95,
          1.25
        ],
        "fallSpeedRange": [
          90,
          135
        ]
      },
      "difficulty": {
        "timeLimit": 54,
        "goal": {
          "type": "catchCount",
          "value": 6
        },
        "phases": []
      },
      "scoring": {
        "pointsPerCorrect": 5,
        "wrongPenalty": 1,
        "wrongFeedback": "Not ×5!",
        "clearReward": 22,
        "bonusTiers": [
          {
            "threshold": 9,
            "reward": 4
          },
          {
            "threshold": 12,
            "reward": 6
          }
        ]
      },
      "presentation": {
        "title": "High Five",
        "prompt": "Catch multiples of 5!"
      }
    },
    {
      "id": "division_grove_3",
      "label": "Thirds Focus",
      "levelNum": 3,
      "slot": 3,
      "activityType": "collect_stream",
      "schemaVersion": 1,
      "sourcePresetId": "collect_multiples_of_3",
      "objective": {
        "rule": {
          "type": "modulo",
          "mod": 3,
          "remainder": 0
        }
      },
      "content": {
        "domain": {
          "kind": "numbers",
          "range": [
            3,
            30
          ]
        },
        "itemCount": 6,
        "spawnDelayRange": [
          0.85,
          1.15
        ],
        "fallSpeedRange": [
          100,
          145
        ]
      },
      "difficulty": {
        "timeLimit": 50,
        "goal": {
          "type": "catchCount",
          "value": 6
        },
        "phases": []
      },
      "scoring": {
        "pointsPerCorrect": 4,
        "wrongPenalty": 1,
        "wrongFeedback": "Not ×3!",
        "clearReward": 25,
        "bonusTiers": [
          {
            "threshold": 9,
            "reward": 5
          },
          {
            "threshold": 12,
            "reward": 7
          }
        ]
      },
      "presentation": {
        "title": "Triple Trail",
        "prompt": "Catch multiples of 3!"
      }
    },
    {
      "id": "division_grove_4",
      "label": "Sixes Stream",
      "levelNum": 4,
      "slot": 4,
      "activityType": "collect_stream",
      "schemaVersion": 1,
      "sourcePresetId": "collect_divisible_by_6",
      "objective": {
        "rule": {
          "type": "modulo",
          "mod": 6,
          "remainder": 0
        }
      },
      "content": {
        "domain": {
          "kind": "numbers",
          "range": [
            6,
            42
          ]
        },
        "itemCount": 7,
        "spawnDelayRange": [
          0.8,
          1.1
        ],
        "fallSpeedRange": [
          105,
          155
        ]
      },
      "difficulty": {
        "timeLimit": 48,
        "goal": {
          "type": "catchCount",
          "value": 7
        },
        "phases": []
      },
      "scoring": {
        "pointsPerCorrect": 6,
        "wrongPenalty": 1,
        "wrongFeedback": "Not ÷6!",
        "clearReward": 29,
        "bonusTiers": [
          {
            "threshold": 10,
            "reward": 5
          },
          {
            "threshold": 13,
            "reward": 7
          }
        ]
      },
      "presentation": {
        "title": "Six in Step",
        "prompt": "Catch numbers divisible by 6!"
      }
    },
    {
      "id": "division_grove_5",
      "label": "Perfect Tens",
      "levelNum": 5,
      "slot": 5,
      "activityType": "collect_stream",
      "schemaVersion": 1,
      "sourcePresetId": "collect_divisible_by_10",
      "objective": {
        "rule": {
          "type": "modulo",
          "mod": 10,
          "remainder": 0
        }
      },
      "content": {
        "domain": {
          "kind": "numbers",
          "range": [
            10,
            60
          ]
        },
        "itemCount": 7,
        "spawnDelayRange": [
          0.75,
          1.05
        ],
        "fallSpeedRange": [
          110,
          160
        ]
      },
      "difficulty": {
        "timeLimit": 46,
        "goal": {
          "type": "catchCount",
          "value": 7
        },
        "phases": []
      },
      "scoring": {
        "pointsPerCorrect": 7,
        "wrongPenalty": 1,
        "wrongFeedback": "Not ÷10!",
        "clearReward": 33,
        "bonusTiers": [
          {
            "threshold": 10,
            "reward": 6
          },
          {
            "threshold": 13,
            "reward": 8
          }
        ]
      },
      "presentation": {
        "title": "Perfect Tens",
        "prompt": "Catch numbers divisible by 10!"
      }
    },
    {
      "id": "division_grove_6",
      "label": "Eights Challenge",
      "levelNum": 6,
      "slot": 6,
      "activityType": "collect_stream",
      "schemaVersion": 1,
      "sourcePresetId": "collect_divisible_by_8",
      "objective": {
        "rule": {
          "type": "modulo",
          "mod": 8,
          "remainder": 0
        }
      },
      "content": {
        "domain": {
          "kind": "numbers",
          "range": [
            8,
            64
          ]
        },
        "itemCount": 8,
        "spawnDelayRange": [
          0.65,
          0.95
        ],
        "fallSpeedRange": [
          115,
          175
        ]
      },
      "difficulty": {
        "timeLimit": 42,
        "goal": {
          "type": "catchCount",
          "value": 8
        },
        "phases": []
      },
      "scoring": {
        "pointsPerCorrect": 7,
        "wrongPenalty": 2,
        "wrongFeedback": "Only equal shares!",
        "clearReward": 38,
        "bonusTiers": [
          {
            "threshold": 11,
            "reward": 6
          },
          {
            "threshold": 14,
            "reward": 8
          }
        ]
      },
      "presentation": {
        "title": "Eight Together",
        "prompt": "Catch numbers divisible by 8!"
      }
    },
    {
      "id": "division_grove_7",
      "label": "Dense Divisors",
      "levelNum": 7,
      "slot": 7,
      "activityType": "collect_stream",
      "schemaVersion": 1,
      "sourcePresetId": "collect_divisible_by_6",
      "objective": {
        "rule": {
          "type": "modulo",
          "mod": 6,
          "remainder": 0
        }
      },
      "content": {
        "domain": {
          "kind": "numbers",
          "range": [
            6,
            54
          ]
        },
        "itemCount": 9,
        "spawnDelayRange": [
          0.55,
          0.85
        ],
        "fallSpeedRange": [
          120,
          180
        ]
      },
      "difficulty": {
        "timeLimit": 40,
        "goal": {
          "type": "catchCount",
          "value": 8
        },
        "phases": []
      },
      "scoring": {
        "pointsPerCorrect": 6,
        "wrongPenalty": 2,
        "wrongFeedback": "Check divisibility!",
        "clearReward": 42,
        "bonusTiers": [
          {
            "threshold": 11,
            "reward": 6
          },
          {
            "threshold": 14,
            "reward": 8
          }
        ]
      },
      "presentation": {
        "title": "Six in Step",
        "prompt": "Catch numbers divisible by 6!"
      }
    },
    {
      "id": "division_grove_8",
      "label": "Fast Divisors",
      "levelNum": 8,
      "slot": 8,
      "activityType": "collect_stream",
      "schemaVersion": 1,
      "sourcePresetId": "collect_divisible_by_10",
      "objective": {
        "rule": {
          "type": "modulo",
          "mod": 10,
          "remainder": 0
        }
      },
      "content": {
        "domain": {
          "kind": "numbers",
          "range": [
            10,
            70
          ]
        },